{
  "schemaVersion": "1.0.0",
  "round_id": "R-0019",
  "title": "C-0002 action 2: DEVAI-governed law invariants, trace, policy and schemas; Owner-accepted draft glossary and product corpus; parity gate and reconciled round indexes",
  "declaring_decision": "D-1",
  "closing_decision": "D-2",
  "batches": [
    {
      "id": "CTG-0001",
      "roles": [
        "Architect",
        "Inspector",
        "Engineer",
        "Auditor"
      ],
      "commit": "968f07296a49f27f7bfccc8f453b36c44ded0373",
      "headline": "Nine governed invariants, nine trace entries, adopter policy, 89 byte-identical DEVAI schemas, law corpus gate rules a/b/e; PR #132 merged."
    },
    {
      "id": "CTG-0002",
      "roles": [
        "Owner",
        "Architect",
        "Inspector",
        "Engineer",
        "Auditor"
      ],
      "commit": "2804b0791dcef403c15fbb56caa5169e07bf49a8",
      "headline": "Owner-accepted draft glossary (44), journeys (40) and use cases (110), gate rules c/d, canonical OD decisions and proof sequence 4; PR #137 merged."
    },
    {
      "id": "CTG-0003",
      "roles": [
        "Architect",
        "Engineer",
        "Auditor"
      ],
      "commit": "673934fc0bb634403b2ae7cfc8abf250183c4777",
      "headline": "R-0019 backlog, orchestra history and round index, TASK-0011 and cross-family review records, exact-SHA CTG-0002 observation and generic proof sequence 5; PR #139 merged."
    }
  ],
  "gates": {
    "cross-family-delivery-review": {
      "status": "pass",
      "detail": "Claude Opus 5.5 via tools/orchestra/bridge.sh: prompt review PASS after correction; each CTG delivery review cycle 2 PASS."
    },
    "owner-acceptance": {
      "status": "pass",
      "detail": "Owner explicitly accepted PR #137 product/ and law/glossary/ content in Codex chat; transcribed in AUTHORIZATION.md Emendas."
    },
    "github-ci": {
      "status": "pass",
      "detail": "PR #132, #137 and #139 merged only after their required checks passed; exact merge SHAs recorded in batches."
    },
    "pnpm-check": {
      "status": "pass",
      "detail": "Full local pnpm check exit 0 on each final CTG tree; CTG-0002 and CTG-0003 status before/after identical."
    },
    "devai-members": {
      "status": "pass",
      "detail": "Eight members pass: invariants 9, trace 9, test-trace, invariant-strategies, glob-guards, schemas, glossary 44, journeys 40."
    },
    "evidence-chain": {
      "status": "pass",
      "detail": "DEVAI 1.5.6 evidence record generic sequences 1-5 and exact-SHA audit observations; chain verified after each active proof."
    },
    "documentation": {
      "status": "pass",
      "detail": "docs:kb:check, docs:kb:publish-check, verify:state-index, format:check and documentation CI pass."
    }
  },
  "source_repo_deleted": false,
  "validation_criteria": [
    {
      "criterion": "Meta 1 — governed invariant catalogue with active gate floor",
      "verdict": "pass",
      "evidence": "9 INV schema-valid; invariant-strategies PASS and DEVAI spec_depth 9 invariants."
    },
    {
      "criterion": "Meta 2 — trace covers every invariant and resolves existing tests",
      "verdict": "pass",
      "evidence": "law/trace.json has 9/9 entries; DEVAI trace and test-trace PASS."
    },
    {
      "criterion": "Meta 3 — adopter policy and policy index without weakened guards",
      "verdict": "pass",
      "evidence": "DEVAI adopter-policy binding generated by init bind; doctor and schemas PASS."
    },
    {
      "criterion": "Meta 4 — law schemas byte-identical to DEVAI 1.5.6",
      "verdict": "pass",
      "evidence": "89 schema copies with manifest hashes; glob-guards and verify:law-corpus PASS."
    },
    {
      "criterion": "Meta 5 — Owner-accepted draft glossary source parity",
      "verdict": "pass",
      "evidence": "44 GE, DEVAI glossary PASS, gate rule c and explicit Owner acceptance on PR #137."
    },
    {
      "criterion": "Meta 6 — Owner-accepted draft journeys and use cases",
      "verdict": "pass",
      "evidence": "40 JNY, 110 UC in six bundles; DEVAI journeys PASS, gate rule d; 294/294 narrative steps source-audited."
    },
    {
      "criterion": "Meta 7 — verify:law-corpus rules a-e and direct rejection tests",
      "verdict": "pass",
      "evidence": "56/56 law tests including 19 direct CTG-0002 negatives; pnpm verify:law-corpus and pnpm check PASS."
    },
    {
      "criterion": "Meta 8 — round indexes and canonical OD register reconciled",
      "verdict": "pass",
      "evidence": "PR #139 indexes, docs KB and state-index gates PASS; OD-R19-001…006 in canonical register."
    },
    {
      "criterion": "Cross-family review, Owner acceptance, CI, evidence and exact-SHA observations",
      "verdict": "pass",
      "evidence": "CTG delivery-review cycle 2 PASS; Owner acceptance in AUTHORIZATION.md; seven green CI checks on PR #137; proof chain verified."
    }
  ],
  "closed_at": "2026-09-27T16:51:25.817Z",
  "merged_as": "673934fc0bb634403b2ae7cfc8abf250183c4777",
  "release_disposition": "none-needed",
  "notes": "D-1 is the Owner authorization in AUTHORIZATION.md to open and execute R-0019, including the token-budget waiver and later separate CTG-0002 content acceptance. D-2 is the Architect judgment to close after three merged CTGs, local and remote gates, cross-family reviews, DEVAI proof records and exact-SHA observations. Open normative gaps remain OD-R19-001…006 as recorded; no source repo was deleted or archived. R-0020 inherits the nine-invariant catalogue, trace, merged commits and observations for sensors and the R-0019 seal; this round does not seal itself.",
  "id": "PC-0016"
}
